{
    "datatypes": {
        "float64": {
            "data_ext": "pd",
            "data_ext_logi": "pd",
            "data_ext_msk": "pd",
            "reg": "__m128d",
            "msk": "__m128d",
            "to_ptr": "float64_t"
        },
        "float32": {
            "data_ext": "ps",
            "data_ext_logi": "ps",
            "data_ext_msk": "ps",
            "reg": "__m128",
            "msk": "__m128",
            "to_ptr": "float32_t"
        },
        "int64": {
            "data_ext": "epi64",
            "data_ext_logi": "si128",
            "data_ext_msk": "si128",
            "reg": "__m128i",
            "msk": "__m128i",
            "to_ptr": "__m128i"
        },
        "int32": {
            "data_ext": "epi32",
            "data_ext_logi": "si128",
            "data_ext_msk": "si128",
            "reg": "__m128i",
            "msk": "__m128i",
            "to_ptr": "__m128i"
        },
        "int16": {
            "data_ext": "epi16",
            "data_ext_logi": "si128",
            "data_ext_msk": "si128",
            "reg": "__m128i",
            "msk": "__m128i",
            "to_ptr": "__m128i"
        },
        "int8": {
            "data_ext": "epi8",
            "data_ext_logi": "si128",
            "data_ext_msk": "si128",
            "reg": "__m128i",
            "msk": "__m128i",
            "to_ptr": "__m128i"
        },
        "uint64": {
            "data_ext": "epu64",
            "data_ext_logi": "si128",
            "data_ext_msk": "si128",
            "reg": "__m128i",
            "msk": "__m128i",
            "to_ptr": "__m128i"
        },
        "uint32": {
            "data_ext": "epu32",
            "data_ext_logi": "si128",
            "data_ext_msk": "si128",
            "reg": "__m128i",
            "msk": "__m128i",
            "to_ptr": "__m128i"
        },
        "uint16": {
            "data_ext": "epu16",
            "data_ext_logi": "si128",
            "data_ext_msk": "si128",
            "reg": "__m128i",
            "msk": "__m128i",
            "to_ptr": "__m128i"
        },
        "uint8": {
            "data_ext": "epu8",
            "data_ext_logi": "si128",
            "data_ext_msk": "si128",
            "reg": "__m128i",
            "msk": "__m128i",
            "to_ptr": "__m128i"
        }
    },
    "define": "defined(__SSE__)",
    "header_template": [
        "#ifndef MY_INTRINSICS_PLUS_PLUS_IMPL_GEN_SSE_H_",
        "#define MY_INTRINSICS_PLUS_PLUS_IMPL_GEN_SSE_H_",
        "#include <immintrin.h>"
    ],
    "hw_lmul": [],
    "info_names": [
        { "if": "defined(__SSE4_2__)", "name": "x86_64 SSE4.2" },
        { "if": "defined(__SSE4_1__)", "name": "x86_64 SSE4.1" },
        { "if": "defined(__SSSE3__)", "name": "x86_64 SSSE3" },
        { "if": "defined(__SSE3__)", "name": "x86_64 SSE3" },
        { "if": "defined(__SSE2__)", "name": "x86_64 SSE2" },
        { "name": "x86 SSE" }
    ],
    "mipp_definitions": [
        "#ifdef __SSE2__",
        "\t#define MIPP_64BIT",
        "\t#define MIPP_BW",
        "#endif"
    ],
    "name": "sse",
    "prefix": "_mm",
    "size": 128,
    "sw_lmul": [
        1,
        2,
        4,
        8
    ]
}
