{
    "datatypes": {
        "float64": {
            "data_ext": "pd",
            "data_ext_logi": "pd",
            "data_ext_msk": "pd",
            "reg": "__m256d",
            "msk": "__m256d",
            "to_ptr": "float64_t"
        },
        "float32": {
            "data_ext": "ps",
            "data_ext_logi": "ps",
            "data_ext_msk": "ps",
            "reg": " __m256",
            "msk": "__m256",
            "to_ptr": "float32_t"
        },
        "int64": {
            "data_ext": "epi64",
            "data_ext_logi": "si256",
            "data_ext_msk": "si256",
            "reg": "__m256i",
            "msk": "__m256i",
            "to_ptr": "__m256i",
            "variables": {
                "data_ext_var": "epi64"
            }
        },
        "int32": {
            "data_ext": "epi32",
            "data_ext_logi": "si256",
            "data_ext_msk": "si256",
            "reg": "__m256i",
            "msk": "__m256i",
            "to_ptr": "__m256i",
            "variables": {
                "data_ext_var": "epi32"
            }
        },
        "int16": {
            "data_ext": "epi16",
            "data_ext_logi": "si256",
            "data_ext_msk": "si256",
            "reg": "__m256i",
            "msk": "__m256i",
            "to_ptr": "__m256i",
            "variables": {
                "data_ext_var": "epi16"
            }
        },
        "int8": {
            "data_ext": "epi8",
            "data_ext_logi": "si256",
            "data_ext_msk": "si256",
            "reg": "__m256i",
            "msk": "__m256i",
            "to_ptr": "__m256i",
            "variables": {
                "data_ext_var": "epi8"
            }
        },
        "uint64": {
            "data_ext": "epu64",
            "data_ext_logi": "si256",
            "data_ext_msk": "si256",
            "reg": "__m256i",
            "msk": "__m256i",
            "to_ptr": "__m256i",
            "variables": {
                "data_ext_var": "epi64"
            }
        },
        "uint32": {
            "data_ext": "epu32",
            "data_ext_logi": "si256",
            "data_ext_msk": "si256",
            "reg": "__m256i",
            "msk": "__m256i",
            "to_ptr": "__m256i",
            "variables": {
                "data_ext_var": "epi32"
            }
        },
        "uint16": {
            "data_ext": "epu16",
            "data_ext_logi": "si256",
            "data_ext_msk": "si256",
            "reg": "__m256i",
            "msk": "__m256i",
            "to_ptr": "__m256i",
            "variables": {
                "data_ext_var": "epi16"
            }
        },
        "uint8": {
            "data_ext": "epu8",
            "data_ext_logi": "si256",
            "data_ext_msk": "si256",
            "reg": "__m256i",
            "msk": "__m256i",
            "to_ptr": "__m256i",
            "variables": {
                "data_ext_var": "epi8"
            }
        }
    },
    "define": "defined(__AVX__)",
    "header_template": [
        "#ifndef MY_INTRINSICS_PLUS_PLUS_IMPL_GEN_AVX_H_",
        "#define MY_INTRINSICS_PLUS_PLUS_IMPL_GEN_AVX_H_",
        "#include <immintrin.h>",
        "#include <mipp/internal/simd_ext/sse/c/common.h> // ldiv 2 support"
    ],
    "hw_lmul": [],
    "info_names": [
        { "if": "defined(__AVX2__)", "name": "x86_64 AVX2" },
        { "name": "x86_64 AVX" }
    ],
    "mipp_definitions": [
        "#define MIPP_64BIT",
        "#ifdef __AVX2__",
        "\t#define MIPP_AVX2",
        "\t#define MIPP_INSTR_VERSION 2",
        "\t#define MIPP_BW",
        "#else",
        "\t#define MIPP_INSTR_VERSION 1",
        "#endif",
        "#ifdef __BMI2__",
        "\t#define MIPP_BMI2",
        "#endif",
        "#ifdef __FMA__",
        "\t#define MIPP_FMA",
        "#endif"
    ],
    "name": "avx",
    "prefix": "_mm256",
    "size": 256,
    "sub_isa": "sse",
    "sw_ldiv_type": "sub_isa",
    "sw_lmul": [
        1,
        2,
        4,
        8,
        -2
    ]
}
