{
    "datatypes": {
        "float64": {
            "reg": "float64_t",
            "msk": "uint64_t",
            "to_ptr": "float64_t"
        },
        "float32": {
            "reg": "float32_t",
            "msk": "uint32_t",
            "to_ptr": "float32_t"
        },
        "int64": {
            "reg": "int64_t",
            "msk": "uint64_t",
            "to_ptr": "int64_t"
        },
        "int32": {
            "reg": "int32_t",
            "msk": "uint32_t",
            "to_ptr": "int32_t"
        },
        "int16": {
            "reg": "int16_t",
            "msk": "uint16_t",
            "to_ptr": "int16_t"
        },
        "int8": {
            "reg": "int8_t",
            "msk": "uint8_t",
            "to_ptr": "int8_t"
        },
        "uint64": {
            "reg": "uint64_t",
            "msk": "uint64_t",
            "to_ptr": "uint64_t"
        },
        "uint32": {
            "reg": "uint32_t",
            "msk": "uint32_t",
            "to_ptr": "uint32_t"
        },
        "uint16": {
            "reg": "uint16_t",
            "msk": "uint16_t",
            "to_ptr": "uint16_t"
        },
        "uint8": {
            "reg": "uint8_t",
            "msk": "uint8_t",
            "to_ptr": "uint8_t"
        }
    },
    "header_template": [
        "#ifndef MY_INTRINSICS_PLUS_PLUS_IMPL_GEN_SCALAR_H_",
        "#define MY_INTRINSICS_PLUS_PLUS_IMPL_GEN_SCALAR_H_"
    ],
    "hw_lmul": [
        1
    ],
    "is_scalar": true,
    "mipp_definitions": [
        "#define MIPP_64BIT",
        "#define MIPP_BW"
    ],
    "name": "scalar",
    "size": "MIPP_SCALAR_SIZE",
    "sw_lmul": []
}
